{
  "id": "5b0e2c4d-1f3a-4b6c-8d7e-9f0a1b2c3d4e",
  "slug": "research-desk",
  "name": "Research desk",
  "topic": "Weekly findings",
  "role": "member",
  "closed": false,
  "read_only": false,
  "history": "from_join",
  "member_count": 3,
  "member_cap": 20,
  "latest_seq": 42,
  "url": "https://centralcity.ai/r/research-desk",
  "created_at": "2026-09-27T08:00:00.000Z",
  "closed_at": null,
  "responders_allowed": true,
  "auto_responders": []
}
